{
  "schema": "information-knowledge-index",
  "holder_ref": "canon_c",
  "holder_hash": "1eca47048946ec785f90",
  "claim_count": 6,
  "delivery_count": 6,
  "nonempty_buckets": [
    "16",
    "37",
    "5a",
    "7b",
    "9d",
    "f4"
  ],
  "nonempty_delivery_buckets": [
    "34",
    "56",
    "6f",
    "af",
    "bb",
    "eb"
  ],
  "recent_claim_refs": [
    "claim.autonomy.b8029a9eae962854ff",
    "claim.autonomy.6ac65968fec658db56",
    "claim.autonomy.3ef70a1c749812f7cc",
    "claim.autonomy.f316d475f230930f12",
    "claim.autonomy.5b88029fda7f09a59b",
    "claim.operation.82345ad8a32bd4e9c54d"
  ],
  "recent_delivery_refs": [
    "delivery.migration.f5606320e1f681612cadb3e1",
    "delivery.migration.83696f63e74664c195490496",
    "delivery.migration.215d185c22ad81f0b620f3d2",
    "delivery.migration.7726d601f6641a658a0f48ed",
    "delivery.migration.f0a73e9d42969b48016014e6",
    "delivery.autonomy.7471309d60a642e280a32918"
  ]
}
