{
  "schema": "information-knowledge-index",
  "holder_ref": "support.mission.haruto_seki",
  "holder_hash": "a9c3b7a2ec7cc8eae9f9",
  "claim_count": 9,
  "delivery_count": 8,
  "nonempty_buckets": [
    "35",
    "3f",
    "79",
    "7a",
    "80",
    "86",
    "88",
    "96",
    "d6"
  ],
  "nonempty_delivery_buckets": [
    "11",
    "37",
    "54",
    "7d",
    "95",
    "c1",
    "c3",
    "e2"
  ],
  "recent_claim_refs": [
    "claim.autonomy.0207e5c65f7a76f29c",
    "claim.autonomy.3a773c3264fcf18b87",
    "claim.operation.36dec3f8420123694de3",
    "claim.autonomy.9e9104a59607289e06",
    "claim.operation.820a07a69b798e616bef",
    "claim.autonomy.0a2a2588a4c5f8c908",
    "claim.world_front.746b831e989a5526d78a155a",
    "claim.autonomy.662f94313f7b28b7eb",
    "claim.world_front.81ab3767578fc9676d8e6c0a"
  ],
  "recent_delivery_refs": [
    "delivery.migration.66b3328a78ecd4eaf1ddc842",
    "delivery.migration.2ff897d2ec81d997057dfd6d",
    "delivery.world_front.98498b31fa22df7805634ae2",
    "delivery.autonomy.0a2a2588a4c5f8c908",
    "delivery.world_front.5d27b62a38d56c84f307cd30",
    "delivery.autonomy.9e9104a59607289e06",
    "delivery.autonomy.662f94313f7b28b7eb",
    "delivery.world_front.dc067bdf4ec037008273ed3f"
  ]
}
