{
  "schema": "information-knowledge-index",
  "holder_ref": "institution.kiri.mizukage_administration",
  "holder_hash": "56a39ed5437b165af893",
  "claim_count": 1,
  "delivery_count": 0,
  "nonempty_buckets": [
    "9a"
  ],
  "nonempty_delivery_buckets": [],
  "recent_claim_refs": [
    "claim.institution.87b7af4f044efe85b826"
  ],
  "recent_delivery_refs": []
}
